{"$schema":"https://json-schema.org/draft/2020-12/schema","additionalProperties":false,"properties":{"coverage":{"type":"object"},"generator_version":{"const":"0.3.0-rc1"},"id":{"pattern":"^[0-9a-f]{24}$","type":"string"},"intent":{"type":"object"},"questions":{"items":{"additionalProperties":false,"properties":{"id":{"pattern":"^[0-9a-f]{24}$","type":"string"},"source":{"pattern":"^[A-Z]{2}$","type":"string"},"target":{"pattern":"^[A-Z]{2}$","type":"string"},"task":{"enum":["reachability","shortest_path","direct_edge"]}},"required":["id","task","source","target"],"type":"object"},"maxItems":2,"minItems":2,"type":"array"},"seed":{"type":"integer"},"slot":{"minimum":0,"type":"integer"},"split":{"enum":["train","validation","test"]},"trial":{"minimum":0,"type":"integer"},"variants":{"items":{"additionalProperties":false,"properties":{"answer_change_evidence":{"type":"object"},"answers":{"additionalProperties":{"oneOf":[{"type":"boolean"},{"minimum":0,"type":"integer"},{"const":"unreachable"}]},"type":"object"},"asset_hashes":{"type":"object"},"assets":{"type":"object"},"certificates":{"additionalProperties":{"additionalProperties":false,"properties":{"distances":{"additionalProperties":{"minimum":0,"type":["integer","null"]},"type":"object"},"kind":{"enum":["edge_claim","path","reachable_set","shortest_path"]},"nodes":{"items":{"pattern":"^[A-Z]{2}$","type":"string"},"type":"array","uniqueItems":true},"path":{"items":{"pattern":"^[A-Z]{2}$","type":"string"},"minItems":2,"type":"array","uniqueItems":true},"present":{"type":"boolean"},"source":{"pattern":"^[A-Z]{2}$","type":"string"},"target":{"pattern":"^[A-Z]{2}$","type":"string"}},"required":["kind"],"type":"object"},"type":"object"},"edit":{"type":["object","null"]},"geometry_checks":{"type":"object"},"graph":{"additionalProperties":false,"properties":{"edges":{"items":{"maxItems":2,"minItems":2,"prefixItems":[{"pattern":"^[A-Z]{2}$","type":"string"},{"pattern":"^[A-Z]{2}$","type":"string"}],"type":"array"},"type":"array","uniqueItems":true},"nodes":{"items":{"pattern":"^[A-Z]{2}$","type":"string"},"maxItems":20,"minItems":6,"type":"array","uniqueItems":true}},"required":["nodes","edges"],"type":"object"},"id":{"pattern":"^[0-9a-f]{24}$","type":"string"},"pixel_change":{"type":"object"},"relevance":{"additionalProperties":{"type":"boolean"},"type":"object"},"role":{"enum":["original","redraw","edited"]},"scene":{"type":"object"},"semantic_changed_edges":{"type":"object"}},"required":["id","role","graph","scene","answers","certificates","relevance","edit","geometry_checks","assets","asset_hashes"],"type":"object"},"maxItems":4,"minItems":4,"type":"array"}},"required":["id","slot","trial","seed","split","generator_version","intent","questions","variants","coverage"],"title":"TopoDelta-QA RC group","type":"object"}
