{"coverage":{"alternative_paths":true,"branches":5,"connectivity":"connected","density_bin":"sparse","difficulty_bin":"medium","directed_density":0.075,"edges":18,"edges_per_node":1.125,"layout":"radial","maximum_finite_shortest_path":3,"merges":6,"nodes":16,"question_sign_fallback":false,"style":1,"topology":"dag","unqueried_nodes":12,"unreachable_ordered_pairs":205,"weak_bridges":7},"generator_version":"0.3.0-rc1","id":"f9216f439b9010d7292d1908","intent":{"connectivity":"connected","density":"sparse","irrelevant_task":"direct_edge","layout":"radial","nodes":16,"operation":"addition","relevant_task":"shortest_path","second_operation":"deletion","slot":10209,"split":"train","style":1,"topology":"dag"},"questions":[{"id":"fdd672820e27bbf2d64e4505","source":"FW","target":"YV","task":"shortest_path"},{"id":"bb13c2967085c2179c11c2f9","source":"AS","target":"JU","task":"direct_edge"}],"seed":15412693879977058072756728571,"slot":10209,"split":"train","trial":0,"variants":[{"answers":{"bb13c2967085c2179c11c2f9":false,"fdd672820e27bbf2d64e4505":"unreachable"},"asset_hashes":{"png":"fea2822069ed4ce15992b9ccaa5a80c7cfd1163fd9a3b39eac0f60e795663411","svg":"843dfd05617994434fe61408a765de0838462b7d5ce9e48a4d8f8fc1191f69ef"},"assets":{"png":"images/81e80d5fe84d0400e2e34179.png","svg":"images/81e80d5fe84d0400e2e34179.svg"},"certificates":{"bb13c2967085c2179c11c2f9":{"kind":"edge_claim","present":false,"source":"AS","target":"JU"},"fdd672820e27bbf2d64e4505":{"kind":"reachable_set","nodes":["FW","ND"]}},"edit":null,"geometry_checks":{"arrow_length_pixels":22,"arrow_width_pixels":16,"font_pixels":26,"minimum_route_clearance":36.546},"graph":{"edges":[["AH","AS"],["AH","CX"],["AH","MU"],["AS","EP"],["AS","YB"],["AS","YV"],["CX","EP"],["FW","ND"],["JP","AS"],["JP","VP"],["LD","YB"],["LG","EP"],["LK","AS"],["LK","JU"],["LK","ND"],["TZ","AS"],["TZ","VP"],["YB","MU"]],"nodes":["AH","AS","CX","EP","FW","JP","JU","LD","LG","LK","MU","ND","TZ","VP","YB","YV"]},"id":"81e80d5fe84d0400e2e34179","relevance":{"bb13c2967085c2179c11c2f9":false,"fdd672820e27bbf2d64e4505":false},"role":"original","scene":{"canvas":[1280,1280],"edges":[{"arrowhead":[[655.3390920619025,683.0232788465282],[673.971090431376,697.1953865500401],[660.5158391486592,705.8531121704874]],"edge":["AH","AS"],"line":[[868.9493079380975,1015.0018211534718],[655.3390920619025,683.0232788465282]]},{"arrowhead":[[749.474636077125,1112.256431814473],[766.8395715071658,1096.5574185489677],[772.8675659130283,1111.3784604638563]],"edge":["AH","CX"],"line":[[841.4292639228751,1074.856768185527],[749.474636077125,1112.256431814473]]},{"arrowhead":[[1005.309069426196,972.2946922270673],[992.2397186924765,991.716125526364],[982.8173325110234,978.7848209267669]],"edge":["AH","MU"],"line":[[943.5844305738042,1017.2703077729327],[1005.309069426196,972.2946922270673]]},{"arrowhead":[[490.6130499933797,1073.5481578031608],[489.8270469514253,1050.1519572736297],[505.0388553013617,1055.111885370367]],"edge":["AS","EP"],"line":[[617.6245500066202,684.0113421968392],[490.6130499933797,1073.5481578031608]]},{"arrowhead":[[1076.7221464976296,735.4339976798104],[1053.567383500884,738.8773899845779],[1056.763981260565,723.1999615359197]],"edge":["AS","YB"],"line":[[683.3408535023702,655.2243023201896],[1076.7221464976296,735.4339976798104]]},{"arrowhead":[[246.7984781186783,816.9448923821703],[263.5843968323933,800.6282464971683],[270.14436354072393,815.2216298192631]],"edge":["AS","YV"],"line":[[578.3135218813217,667.9234076178296],[246.7984781186783,816.9448923821703]]},{"arrowhead":[[530.6765106734197,1118.0378457165666],[553.3236367873942,1112.1126724045246],[551.839747851719,1128.0437136017151]],"edge":["CX","EP"],"line":[[644.1765893265804,1128.6097542834334],[530.6765106734197,1118.0378457165666]]},{"arrowhead":[[180.0289077046971,470.3908461196638],[183.3513698275141,493.5632703657898],[167.69084339255622,490.28486956967197]],"edge":["FW","ND"],"line":[[154.97439229530275,590.0732538803362],[180.0289077046971,470.3908461196638]]},{"arrowhead":[[678.6614200723538,608.0235714925266],[691.3764235070496,588.3683256875086],[701.0317630758914,601.1266334832299]],"edge":["JP","AS"],"line":[[984.7891799276462,376.3496285074734],[678.6614200723538,608.0235714925266]]},{"arrowhead":[[937.8167941447421,247.13995757778488],[959.1512715265255,256.77531303807626],[947.9789024993524,268.2286169422195]],"edge":["JP","VP"],"line":[[994.706305855258,302.63404242221515],[937.8167941447421,247.13995757778488]]},{"arrowhead":[[1130.2307274502602,706.2049389286009],[1122.6113889483834,684.0702222872292],[1138.6090086308707,684.3462014431323]],"edge":["LD","YB"],"line":[[1132.6692725497398,564.8503610713992],[1130.2307274502602,706.2049389286009]]},{"arrowhead":[[426.1543825623972,1079.8134664564068],[403.3327115169814,1074.6008538010456],[412.0115683573105,1061.159222800863]],"edge":["LG","EP"],"line":[[354.49991743760273,1033.5483335435931],[426.1543825623972,1079.8134664564068]]},{"arrowhead":[[599.1530472188671,606.5188205978479],[578.9682178642568,594.6624862602348],[591.2986701347493,584.4664111916065]],"edge":["LK","AS"],"line":[[350.60555278113293,305.94207940215205],[599.1530472188671,606.5188205978479]]},{"arrowhead":[[432.3170332551719,193.42144919203247],[418.3567443767251,212.21267944527335],[409.5472624922368,198.85629412113445]],"edge":["LK","JU"],"line":[[370.74926674482816,234.0297508079675],[432.3170332551719,193.42144919203247]]},{"arrowhead":[[218.96127763453043,392.5711196597913],[226.52505880761555,370.4173566754655],[238.98849052354217,380.4504454253189]],"edge":["LK","ND"],"line":[[288.63762236546955,306.0168803402087],[218.96127763453043,392.5711196597913]]},{"arrowhead":[[635.6448098557883,604.5278689840021],[630.5094454794297,581.6886913998152],[646.3793672856481,583.7247616010883]],"edge":["TZ","AS"],"line":[[689.2915901442117,186.38403101599786],[635.6448098557883,604.5278689840021]]},{"arrowhead":[[846.9959257296765,193.60309804088664],[823.6147256410871,194.75178529917287],[828.3381849411286,179.46489770748656]],"edge":["TZ","VP"],"line":[[747.0129742703235,162.70960195911337],[846.9959257296765,193.60309804088664]]},{"arrowhead":[[1070.567118578775,896.6156230055074],[1071.1497043653392,873.2134736640197],[1086.0456634666596,879.0538848183645]],"edge":["YB","MU"],"line":[[1114.100981421225,785.5825769944927],[1070.567118578775,896.6156230055074]]}],"nodes":[{"box":[849.7661,1022.5704000000001,937.7661,1084.5704],"center":[893.7661,1053.5704],"label":"AH","label_box":[875.7661,1045.5704,911.7661,1063.5704]},{"box":[586.5223,613.4547,674.5223,675.4547],"center":[630.5223,644.4547],"label":"AS","label_box":[614.5223,636.4547,646.5223,654.4547]},{"box":[653.1378,1102.5428,741.1378,1164.5428],"center":[697.1378,1133.5428],"label":"CX","label_box":[680.1378,1125.5428,715.1378,1143.5428]},{"box":[433.71529999999996,1082.1048,521.7153,1144.1048],"center":[477.71529999999996,1113.1048],"label":"EP","label_box":[461.71529999999996,1105.1048,493.71529999999996,1123.1048]},{"box":[102.64069999999992,598.8823,190.64069999999992,660.8823],"center":[146.64069999999992,629.8823],"label":"FW","label_box":[126.64069999999992,621.8823,166.64069999999992,639.8823]},{"box":[988.9283,308.9185,1076.9283,370.9185],"center":[1032.9283,339.9185],"label":"JP","label_box":[1017.9283,331.9185,1047.9283,349.9185]},{"box":[439.83000000000004,128.445,527.83,190.445],"center":[483.83000000000004,159.445],"label":"JU","label_box":[467.83000000000004,151.445,498.83000000000004,169.445]},{"box":[1089.3593,493.85170000000005,1177.3593,555.8517],"center":[1133.3593,524.8517],"label":"LD","label_box":[1115.3593,516.8517,1150.3593,534.8517]},{"box":[258.93899999999996,969.257,346.93899999999996,1031.257],"center":[302.93899999999996,1000.257],"label":"LG","label_box":[284.93899999999996,992.257,319.93899999999996,1010.257]},{"box":[275.2363,237.00619999999998,363.2363,299.0062],"center":[319.2363,268.0062],"label":"LK","label_box":[303.2363,260.0062,336.2363,278.0062]},{"box":[1011.1274000000001,904.9946,1099.1274,966.9946],"center":[1055.1274,935.9946],"label":"MU","label_box":[1035.1274,927.9946,1075.1274,945.9946]},{"box":[144.36259999999993,399.5818,232.36259999999993,461.5818],"center":[188.36259999999993,430.5818],"label":"ND","label_box":[169.36259999999993,422.5818,207.36259999999993,440.5818]},{"box":[650.4141,115.4572,738.4141,177.4572],"center":[694.4141,146.4572],"label":"TZ","label_box":[678.4141,138.4572,710.4141,156.4572]},{"box":[855.5948000000001,178.8555,943.5948000000001,240.8555],"center":[899.5948000000001,209.8555],"label":"VP","label_box":[883.5948000000001,201.8555,915.5948000000001,219.8555]},{"box":[1085.5407,715.2036,1173.5407,777.2036],"center":[1129.5407,746.2036],"label":"YB","label_box":[1113.5407,738.2036,1144.5407,756.2036]},{"box":[150.5897,809.4136,238.5897,871.4136],"center":[194.5897,840.4136],"label":"YV","label_box":[178.5897,832.4136,210.5897,850.4136]}],"style":1}},{"answers":{"bb13c2967085c2179c11c2f9":false,"fdd672820e27bbf2d64e4505":"unreachable"},"asset_hashes":{"png":"96da90d9658eb48f7b3b67a17a42f93954f43f4f71190d4aa643f7d360236cb5","svg":"e8e453702ab03696f6d96b2a3babe8869ea61479d83a9beadbac2c7753244cf3"},"assets":{"png":"images/77bc18bd2419b42b992ee213.png","svg":"images/77bc18bd2419b42b992ee213.svg"},"certificates":{"bb13c2967085c2179c11c2f9":{"kind":"edge_claim","present":false,"source":"AS","target":"JU"},"fdd672820e27bbf2d64e4505":{"kind":"reachable_set","nodes":["FW","ND"]}},"edit":null,"geometry_checks":{"arrow_length_pixels":22,"arrow_width_pixels":16,"font_pixels":26,"minimum_route_clearance":37.0469},"graph":{"edges":[["AH","AS"],["AH","CX"],["AH","MU"],["AS","EP"],["AS","YB"],["AS","YV"],["CX","EP"],["FW","ND"],["JP","AS"],["JP","VP"],["LD","YB"],["LG","EP"],["LK","AS"],["LK","JU"],["LK","ND"],["TZ","AS"],["TZ","VP"],["YB","MU"]],"nodes":["AH","AS","CX","EP","FW","JP","JU","LD","LG","LK","MU","ND","TZ","VP","YB","YV"]},"id":"77bc18bd2419b42b992ee213","relevance":{"